PostId,TypeId,IsBest,Score,API,Sentences
24459669,2,1,1,javax.xml.bind.JAXB,"First, JAXB will not inject the default value into the message, if the element is not present in the original message sent."
24553468,2,1,0,javax.xml.bind.JAXB,Apparently JAXB cannot handle lists.
25150924,2,1,0,javax.xml.bind.JAXB,Handling a Problematic Class When you have a class that JAXB can't convert by default you can use an XmlAdapter to convert it to one that can for the purpose of marshalling & unmarshalling.
25176136,2,0,0,javax.xml.bind.JAXB,Maybe yo'll need to employ other languages than Java (or environments which don't have adequate JAXB).
25176136,2,0,0,javax.xml.bind.JAXB,Or you may also have schemas where application of JAXB is not adequate.
25263281,2,0,1,javax.xml.bind.JAXB,It looks like JAXB isn't expecting the <response> root element when unmarshalling to a Customer object.
25685725,2,1,0,javax.xml.bind.JAXB,http://blog.bdoughan.com/2010/08/jaxb-namespaces.html  If You Can't Change The Model If you can't change the JAXB model to remove the namespace qualification then you can leverage a SAX XMLFilter to apply a namespace to the XML as it's being read.
26019173,2,0,0,javax.xml.bind.JAXB,Your first XPath refers to the xs:element and I think JAXB does not know how to bind a class to it.
26346585,2,1,3,javax.xml.bind.JAXB,"Please don't take JAXB as the only answer, check alternatives as well."
26515995,2,1,0,javax.xml.bind.JAXB,"Since Java classes and XML Schema are not a perfect match, and JAXB does not put any JAXB specific metadata in the generated schema some information is lost."
26572605,2,1,1,javax.xml.bind.JAXB,It seems like JAXB does not run on Android OOTB.
26572080,2,0,3,javax.xml.bind.JAXB,"If you don't already use JAXB, you might want to put this method into a utility class."
26584677,2,1,2,javax.xml.bind.JAXB,You have to specify the schema if you want to turn on the validation: Validating against a Schema with JAXB JAXB is not strict on mappings.
26678738,2,1,1,javax.xml.bind.JAXB,"This will work in most cases, if you are using JAXB annotations (which could return XML or JSON), because of the pulled in artifact jackson-module-jaxb-annotations, but that artifact doesn't support all JAXB annotations, so you might need to pull in the resteasy-jaxb-provider, if need be."
26690945,2,0,1,javax.xml.bind.JAXB,"In addition to keeping my domain built around interfaces (something JAXB really doesn't like), which was important for different implementations like you mentioned, it also allowed me to define different JAXB value object when I did need to have different ""views"" defined."
26715088,2,1,3,javax.xml.bind.JAXB,"Handling Interfaces  // JAXB does not deal with interfaces by default >:(  Now that JAXB is no longer aware of the Precondition query class, you could make it an interface if you wanted to."
27128122,2,1,1,javax.xml.bind.JAXB,JAXB doesn't consider any empty element to be a valid representation of null.
27780305,2,0,1,javax.xml.bind.JAXB,JAXB is not bad as it will ignore elements it does not know (apart from the root element).
27783455,2,0,0,javax.xml.bind.JAXB,"Due the JAXB does not handle interfaces, only value classes and content interfaces, the adapter must use the concrete implementation."
27845082,2,0,1,javax.xml.bind.JAXB,"Sadly I couldn't get JAXB to run with the children held by GeneralLocation, I get an UnmarshalException (could not create an instance of GeneralLocation) but I hope this helps anyway."
27941126,2,1,1,javax.xml.bind.JAXB,"If JAXB does not have an association between the element and a class, then it will convert it to a DOM Element."
28089691,2,0,0,javax.xml.bind.JAXB,JAXB doesn't require any annotations so you can start doing this right away.
28159605,2,0,3,javax.xml.bind.JAXB,"No, current version of JAXB does not support XSD 1.1."
28237376,2,0,0,javax.xml.bind.JAXB,If you want to put the xml file in a string you don't need JAXB.
31649254,2,0,0,javax.xml.bind.JAXB,It's annoying that JPA doesn't support Converters on Ids or that it doesn't follow the JAXB convention of not requiring converters for classes with standard conversion methods (ie.
28911043,2,1,1,javax.xml.bind.JAXB,By default JAXB shouldn't be complaining about the extra element.
28962609,2,1,2,javax.xml.bind.JAXB,JAXB isn't compatible to FXCollections like the ObservableList in your wrapper.
30282010,2,1,1,javax.xml.bind.JAXB,"Also, you may not face this problem with your GET request, but with POST request, when you try and send XML, JAXB will not be able to create your other classes either, because they don't have no-arg constructors."
31750313,2,0,0,javax.xml.bind.JAXB,As per exception JAXB does not allow lists to be null when marschalling.
32015804,2,0,0,javax.xml.bind.JAXB,"Also Axis2 doesn't use JAXB but instead offers the choice of ADB (default), Apache XmlBeans, or JiBX for data-binding."
